{"$schema":"https://json-schema.org/draft/2020-12/schema","$id":"CTR-FLG-001","title":"Feature Policy Decision","type":"object","additionalProperties":false,"required":["policy_key","effect","decided_at","decision_source","reason_key","evaluated_scopes"],"properties":{"policy_key":{"type":"string","pattern":"^[a-z][a-z0-9.]*$","x-source":"FP-001 typed policy decision contract. The key SYNTAX is a DECLARED INFERENCE; FP-001 states none."},"effect":{"enum":["allow","deny"],"x-source":"FP-001 typed policy decision."},"decided_at":{"type":"string","format":"date-time","x-source":"FP-005 requires every change to carry a time. Applying it to the decision itself is a DECLARED INFERENCE."},"decision_source":{"type":"object","additionalProperties":false,"required":["scope","rule"],"properties":{"scope":{"enum":["platform","plan","workspace","business","capability"]},"rule":{"enum":["kill_switch","explicit_deny","explicit_allow","percentage_bucket","default_deny"]}},"x-source":"FP-001 requires the decision to include its reason AND its source."},"reason_key":{"type":"string","pattern":"^policy\\.[a-z_.]+$","x-source":"FP-001 requires a reason; CTR-ERR-001 uses a stable Thai message key, so the reason is a key, not prose."},"evaluated_scopes":{"enum":[["platform"],["platform","plan"],["platform","plan","workspace"],["platform","plan","workspace","business"],["platform","plan","workspace","business","capability"]],"x-source":"FP-002 fixes the precedence platform -> plan -> workspace -> business -> capability. Evaluation always starts at platform and stops somewhere along that order, so the value must be an in-order PREFIX of it. The previous form enforced membership only, and a reversed list and a platform kill switch claiming platform was never evaluated both validated. Independent review showed the order half is expressible here and that declaring it untestable was covering a testable property."},"bucket":{"type":"object","additionalProperties":false,"required":["percentage","allocated"],"properties":{"percentage":{"type":"integer","minimum":0,"maximum":100},"allocated":{"type":"boolean"}},"x-source":"FP-003 stable allocation: a workspace stays in the same bucket."},"write_disabled":{"type":"boolean","x-source":"FP-002 and FP-004: closing writes must still permit historical read."},"historical_read_allowed":{"type":"boolean","x-source":"FP-002 'historical read still works when write is closed'."},"audit":{"type":"object","additionalProperties":false,"required":["actor","reason_key","changed_at"],"properties":{"actor":{"type":"object","additionalProperties":false,"required":["kind","id"],"properties":{"kind":{"enum":["user","system_actor"]},"id":{"type":"string","minLength":1}}},"reason_key":{"type":"string","pattern":"^policy\\.[a-z_.]+$"},"changed_at":{"type":"string","format":"date-time"},"expires_at":{"type":"string","format":"date-time"},"owner_role":{"enum":["A0","A1","A2","A3","A4","A5","A6"]}},"x-source":"FP-005 every change carries actor, reason and time; a temporary flag carries an expiry and an owner."},"temporary":{"type":"boolean","x-source":"FP-005 distinguishes a temporary flag, which must expire and have an owner."}},"allOf":[{"if":{"properties":{"decision_source":{"properties":{"rule":{"const":"percentage_bucket"}},"required":["rule"]}},"required":["decision_source"]},"then":{"required":["bucket"],"x-rule":"FP-003: a percentage decision must show the allocation it came from."}},{"if":{"properties":{"decision_source":{"properties":{"rule":{"const":"kill_switch"}},"required":["rule"]}},"required":["decision_source"]},"then":{"properties":{"effect":{"const":"deny"},"decision_source":{"properties":{"scope":{"const":"platform"}}}},"x-rule":"FP-002/FP-004: a kill switch is a platform-scope deny that no narrower scope may override."}},{"if":{"properties":{"write_disabled":{"const":true}},"required":["write_disabled"]},"then":{"required":["historical_read_allowed"],"properties":{"historical_read_allowed":{"const":true}},"x-rule":"FP-002: disabling write must not remove historical read."}},{"if":{"properties":{"temporary":{"const":true}},"required":["temporary"]},"then":{"required":["audit"],"properties":{"audit":{"required":["expires_at","owner_role"]}},"x-rule":"FP-005: a temporary flag must carry an expiry and an owner."}},{"if":{"properties":{"decision_source":{"properties":{"rule":{"const":"default_deny"}},"required":["rule"]}},"required":["decision_source"]},"then":{"properties":{"effect":{"const":"deny"}},"required":["effect"]},"x-rule":"FP-001: a decision carries its reason AND source, so `default_deny` cannot report effect other than `deny`. Independent review and independent testing both showed default_deny with effect allow validating while only kill_switch was linked."},{"if":{"properties":{"decision_source":{"properties":{"rule":{"const":"explicit_deny"}},"required":["rule"]}},"required":["decision_source"]},"then":{"properties":{"effect":{"const":"deny"}},"required":["effect"]},"x-rule":"FP-001: a decision carries its reason AND source, so `explicit_deny` cannot report effect other than `deny`. Independent review and independent testing both showed default_deny with effect allow validating while only kill_switch was linked."},{"if":{"properties":{"decision_source":{"properties":{"rule":{"const":"explicit_allow"}},"required":["rule"]}},"required":["decision_source"]},"then":{"properties":{"effect":{"const":"allow"}},"required":["effect"]},"x-rule":"FP-001: a decision carries its reason AND source, so `explicit_allow` cannot report effect other than `allow`. Independent review and independent testing both showed default_deny with effect allow validating while only kill_switch was linked."}]}
