{"policy_key":"content.generation","effect":"allow","decided_at":"2026-08-31T10:00:00Z","decision_source":{"scope":"workspace","rule":"explicit_allow"},"reason_key":"policy.workspace.explicit_allow","evaluated_scopes":["platform","plan","workspace"],"temporary":true,"audit":{"actor":{"kind":"user","id":"usr_synthetic_0001"},"reason_key":"policy.admin.enable","changed_at":"2026-08-31T09:00:00Z","expires_at":"2026-09-30T00:00:00Z","owner_role":"A0"}}
